text,user
"I had a very respectful conversation with the widow of Sgt. La David Johnson, and spoke his name from beginning, without hesitation!",realDonaldTrump
"Two dozen NFL players continue to kneel during the National Anthem, showing total disrespect to our Flag &amp; Country.  No leadership in NFL!",realDonaldTrump
"There will be NO change to your 401(k). This has always been a great and popular middle class tax break that works, and it stays!",realDonaldTrump
"It is finally sinking through. 46% OF PEOPLE BELIEVE MAJOR NATIONAL NEWS ORGS FABRICATE STORIES ABOUT ME. FAKE NEWS, even worse! Lost cred.",realDonaldTrump
"Wacky Congresswoman Wilson is the gift that keeps on giving for the Republican Party, a disaster for Dems. You watch her in action &amp; vote R!",realDonaldTrump
Doing interview today with Maria Bartiromo at 10:00 A.M. on @FoxNews - ENJOY!,realDonaldTrump
"...2nd Amendment, Strong Military, ISIS, historic VA improvement, Supreme Court Justice, Record Stock Market, lowest unemployment in 17 yrs!",realDonaldTrump
"...9 months than this Administration. Over 50 Legislation approvals, massive regulation cuts, energy freedom, pipelines, border security....",realDonaldTrump
"I agree getting Tax Cuts approved  is important (we will also get HealthCare), but perhaps no Administration has done more in its first.....",realDonaldTrump
"Just out, but lightly reported: ""Fewest jobless claims since 1973 show firm U.S. Job Market"" Lowest since March 1973. @bpolitics",realDonaldTrump
"Crooked Hillary Clinton spent hundreds of millions of dollars more on Presidential Election than I did. Facebook was on her side, not mine!",realDonaldTrump
"Keep hearing about ""tiny"" amount of money spent on Facebook ads. What about the billions of dollars of Fake News on CNN, ABC, NBC &amp; CBS?",realDonaldTrump
"Officials behind the now discredited ""Dossier"" plead the Fifth. Justice Department and/or FBI should immediately release who paid for it.",realDonaldTrump
ÛÏTrump hails liberation of Raqqa as critical breakthrough in anti-ISIS campaignÛ https://t.co/2eoYXJB7h0,realDonaldTrump
Stock Market hits another all time high on Friday. 5.3 trillion dollars up since Election. Fake News doesn't spent much time on this!,realDonaldTrump
People get what is going on! https://t.co/Pdg7VqQv6M,realDonaldTrump
RT @IamVicky4Trump: TUNE IN: Maria Bartiromo Has an Exclusive Interview With President Trump https://t.co/H5VuJwy78o,realDonaldTrump
"Subject to the receipt of further information, I will be allowing, as President, the long blocked and classified JFK FILES to be opened.",realDonaldTrump
"I hope the Fake News Media keeps talking about Wacky Congresswoman Wilson in that she, as a representative, is killing the Democrat Party!",realDonaldTrump
"Budget that just passed is a really big deal, especially in terms of what will be the biggest tax cut in U.S. history - MSM barely covered!",realDonaldTrump
"Great book just out, ""A Place Called Heaven,"" by Dr. Robert Jeffress - A wonderful man!",realDonaldTrump
This is a once-in-a-generation opportunity to offer historic tax relief to the American people! Join me today: https://t.co/9czcJDbmVW https://t.co/s3kXpvbYih,realDonaldTrump
"Today, it was an honor to have @UNSecretary-General @AntonioGuterres at the @WhiteHouse. Speaking for the U.S.A., we appreciate all you do! https://t.co/Sk0Jcazzxw",realDonaldTrump
Thank you @GeraldoRivera @FoxandFriends. Agree! https://t.co/8cZLdAbgzw,realDonaldTrump
"Just out report: ""United Kingdom crime rises 13% annually amid spread of Radical Islamic terror."" Not good, we must keep America safe!",realDonaldTrump
"....This now allows for the passage of large scale Tax Cuts (and Reform), which will be the biggest in the history of our country!",realDonaldTrump
"The Budget passed late last night, 51 to 49. We got ZERO Democrat votes with only Rand Paul (he will vote for Tax Cuts) voting against.....",realDonaldTrump
Great news on the 2018 budget @SenateMajLdr McConnell - first step toward delivering MASSIVE tax cuts for the American people! #TaxReform https://t.co/aBzQR7KR0c,realDonaldTrump
Big ratings getter @seanhannity and Apprentice Champion John Rich are right now going on stage in Las Vegas for #VegasStrong. Great Show!,realDonaldTrump
"The Fake News is going crazy with wacky Congresswoman Wilson(D), who was SECRETLY on a very personal call, and gave a total lie on content!",realDonaldTrump
"Keep up the GREAT work. I am with you 100%!""ISIS is losing its grip...""Army Colonel Ryan DillonCJTFÛÒOIRhttps://t.co/jVGuvv5mzm https://t.co/PSCXg38CtS",realDonaldTrump
It was great to have Governor @RicardoRossello of #PuertoRico_Ùàµ_Ùàáwith us at the @WhiteHouse today. We are with you! #PRStrong https://t.co/Op2xDZxvNc,realDonaldTrump
RT @USArmy333: @804StreetMedia @realDonaldTrump HeÛªs done more in 9 months then obama did in8 yrs,realDonaldTrump
".@foxandfriends ""Russia sent millions to Clinton Foundation""",realDonaldTrump
"Workers of firm involved with the discredited and Fake Dossier take the 5th. Who paid for it, Russia, the FBI or the Dems (or all)?",realDonaldTrump
"Uranium deal to Russia, with Clinton help and Obama Administration knowledge, is the biggest story that Fake Media doesn't want to follow!",realDonaldTrump
"Republicans are going for the big Budget approval today, first step toward massive tax cuts. I think we have the votes, but who knows?",realDonaldTrump
"""46% of Americans think the Media is inventing stories about Trump &amp; his Administration."" @FoxNews   It is actually much worse than this!",realDonaldTrump
".@DanaPerino &amp; @BradThor,Thank you so much for the wonderful compliment. Working hard! #MAGA https://t.co/AKWlsMsCVH",realDonaldTrump
"""20,000_ÙÒö21,000_ÙÒö22,000_ÙÒö 23,000_ÙÒöthis year...FOUR one thousand milestones this year..."" #Dow23K #MAGA https://t.co/GQ5f2eVvEI",realDonaldTrump
This is what REAL PRIDE in our COUNTRY is all about! #USA_Ùà¼_Ùàü https://t.co/kyv866prdE,realDonaldTrump
".@NFL: Too much talk, not enough action. Stand for the National Anthem.",realDonaldTrump
"""Iran hides behind its assertion of technical compliance w/the nuclear deal, while it brazenly violates the other limits..""Amb. @NikkiHaley https://t.co/xvHgx7d1cT",realDonaldTrump
It was an honor to welcome Republican and Democratic members of the Senate Finance Committee to the @WhiteHouse today. #TaxReform https://t.co/ge4Xic9fId,realDonaldTrump
Our hearts are with all affected by the wildfires in California. God bless our brave First Responders and @FEMA team. We support you! https://t.co/YaoPbaVI5L,realDonaldTrump
The current tax code is a burden on American taxpayers &amp; harmful to job-creators. Americans need #TaxReform! More: https://t.co/qXyiYiFWCO https://t.co/NGIjJOc3TP,realDonaldTrump
"I am supportive of Lamar as a person &amp; also of the process, but I can never support bailing out ins co's who have made a fortune w/ O'Care.",realDonaldTrump
Democrat Congresswoman totally fabricated what I said to the wife of a soldier who died in action (and I have proof). Sad!,realDonaldTrump
The NFL has decided that it will not force players to stand for the playing of our National Anthem. Total disrespect for our great country!,realDonaldTrump
"As it has turned out, James Comey lied and leaked and totally protected Hillary Clinton. He was the best thing that ever happened to her!",realDonaldTrump
"The Democrats will only vote for Tax Increases. Hopefully, all Senate Republicans will vote for the largest Tax Cuts in U.S. history.",realDonaldTrump
"...people not interviewed, including Clinton herself. Comey stated under oath that he didn't do this-obviously a fix? Where is Justice Dept?",realDonaldTrump
"Wow, FBI confirms report that James Comey drafted letter exonerating  Crooked Hillary Clinton long before investigation was complete. Many..",realDonaldTrump
The most important truth our FOUNDERS understood was: FREEDOM is NOT a gift from Govt. FREEDOM is a GIFT from GOD. _Ù_´https://t.co/rmAzGt8SuG https://t.co/SrPavwrt2R,realDonaldTrump
"Thank you @Heritage! This is our once-in-a-generation opportunity to revitalize our economy, revive our industry &amp; renew the AMERICAN DREAM! https://t.co/HI30nojsGo",realDonaldTrump
WOW! https://t.co/eKfRktNVuy,realDonaldTrump
BORDER WALL prototypes underway! https://t.co/arFNO80zmO,realDonaldTrump
"Any increase in ObamaCare premiums is the fault of the Democrats for giving us a ""product"" that never had a chance of working.",realDonaldTrump
"So much Fake News being put in dying magazines and newspapers. Only place worse may be @NBCNews, @CBSNews, @ABC and @CNN. Fiction writers!",realDonaldTrump
It was my great honor to welcome Prime Minister Alexis Tsipras of Greece to the WH today! _Ù_´https://t.co/Bn1vM6fYW9 _ÙÒühttps://t.co/j0roMFT3YL https://t.co/MPe5HWFcZ1,realDonaldTrump
Join me LIVE from the Rose Garden at 1:30pmE with Prime Minister Alexis Tsipras of Greece. _Áühttps://t.co/Bn1vM6fYW9 https://t.co/dZB4mDBKpi,realDonaldTrump
"""Dow Passes 23,000 for the First Time, Fueled by Strong Earnings""#Dow23K_ÙÒöhttps://t.co/wnkrddYlb9 https://t.co/wlP0NCNcou",realDonaldTrump
Rep.Tom Marino has informed me that he is withdrawing his name from consideration as drug czar. Tom is a fine man and a great Congressman!,realDonaldTrump
RT @Scavino45: U.S. MARKETS FROM ELECTION DAY {Since 11/8/2016} _ÙÒö https://t.co/HtjHrznQKJ,realDonaldTrump
Always great to see the wonderful people of South Carolina. Thank you for the beautiful welcome at Greenville-Spartanburg Int'l Airport! https://t.co/maO9Nc0sTe,realDonaldTrump
"I was recently asked if Crooked Hillary Clinton is going to run in 2020? My answer was, ""I hope so!""",realDonaldTrump
"The U.S. has gained more than 5.2 trillion dollars in Stock Market Value since Election Day! Also, record business enthusiasm.",realDonaldTrump
"Since Election Day on November 8, the Stock Market is up more than 25%, unemployment is at a 17 year low &amp; companies are coming back to U.S.",realDonaldTrump
"Dem Senator Schumer hated the Iran deal made by President Obama, but now that I am involved, he is OK with it. Tell that to Israel, Chuck!",realDonaldTrump
The Democrats only want to increase taxes and obstruct. That's all they are good at!,realDonaldTrump
Art Laffer just said that he doesn't know how a Democrat could vote against the big tax cut/reform bill and live with themselves!  @FoxNews,realDonaldTrump
RT @ABCNewsRadio: Global fund championed by Ivanka Trump to help women entrepreneurs begins operations https://t.co/jUmsY3ON4x https://t.coÛ_,realDonaldTrump
RT @mike_pence: .@EdWGillespie is fighting to grow the economy &amp; cut taxes! HeÛªs fighting for a safer VA. And heÛªs is fighting for affordabÛ_,realDonaldTrump
"...approvals of The Keystone XL &amp; Dakota Access pipelines. Also, look at the recent EPA cancelations &amp; our great new Supreme Court Justice!",realDonaldTrump
"The Failing @nytimes, in a story by Peter Baker, should have mentioned the rapid terminations by me of TPP &amp; The Paris Accord &amp; the fast....",realDonaldTrump
"RT @FoxNews: TONIGHT on ""Justice,"" @JudgeJeanine talks to special guests @EricTrump and @LaraLeaTrump - Tune in at 9p ET on Fox News ChanneÛ_",realDonaldTrump
RT @EricTrump: .@LaraLeaTrump and I look forward to being on @JudgeJeanine tonight at 9pm! @FoxNews #MakeAmericaGreatAgain _Ùà¼_Ùàü_Ùà¼_Ùàü_Ùà¼_Ùàü https://tÛ_,realDonaldTrump
RT @mike_pence: We are heading to Virginia. Looking forward to supporting my friend @EdWGillespie. He will make a great Governor for the CoÛ_,realDonaldTrump
The Democrats in the Southwest part of Virginia have been abandoned by their Party. Republican Ed Gillespie will never let you down!,realDonaldTrump
Very proud of my Executive Order which will allow greatly expanded access and far lower costs for HealthCare. Millions of people benefit!,realDonaldTrump
"Health Insurance stocks, which have gone through the roof during the ObamaCare years, plunged yesterday after I ended their Dems windfall!",realDonaldTrump
"RT @realDonaldTrump: ""Consumer confidence soars to highest level since 2004""_ÙÒöhttps://t.co/RvxCPAFI2A https://t.co/U8MS9K45fX",realDonaldTrump
RT @RightlyNews: @realDonaldTrump @LouDobbs Trust in the media is at the lowest level in all of U.S. history. The American people see throuÛ_,realDonaldTrump
RT @RightlyNews: @realDonaldTrump @LouDobbs It is NOT a coincidence that the economy boomed immediately after the 2016 election.,realDonaldTrump
"Such a wonderful statement from the great @LouDobbs. ""We take up what may be the most accomplished presidency in modern American history.""",realDonaldTrump
"ObamaCare is causing such grief and tragedy for so many. It is being dismantled but in the meantime, premiums &amp; deductibles are way up!",realDonaldTrump
"Money pouring into Insurance Companies profits, under the guise of ObamaCare, is over. They have made a fortune.Dems must get smart &amp; deal!",realDonaldTrump
"Many people talking, with much agreement, on my Iran speech today. Participants in the deal are making lots of money on trade with Iran!",realDonaldTrump
Starting to develop a much better relationship with Pakistan and its leaders. I want to thank them for their cooperation on many fronts.,realDonaldTrump
#WeeklyAddress_Ùà¼_Ùàü https://t.co/riqEiBNwk2,realDonaldTrump
"Today, I announced our strategy to confront the Iranian regimeÛªs hostile actions and to ensure that they never acquire a nuclear weapon. https://t.co/N4ISdjuEdC",realDonaldTrump
"""Consumer confidence soars to highest level since 2004""_ÙÒöhttps://t.co/RvxCPAFI2A https://t.co/U8MS9K45fX",realDonaldTrump
"In America, we don't worship government - we worship God. #ValuesVotersSummit https://t.co/YQ3iDlWylK",realDonaldTrump
I have no greater privilege than to serve as your Commander-in-Chief. HAPPY BIRTHDAY to the incredible men and women @USNavy!#242NavyBday https://t.co/qcdB4U8CqA,realDonaldTrump
"The wonderful people of Puerto Rico, with their unmatched spirit, know how bad things were before the H's. I will always be with them!",realDonaldTrump
"Hard to believe that the Democrats, who have gone so far LEFT that they are no longer recognizable, are fighting so hard for Sanctuary crime",realDonaldTrump
ObamaCare is a broken mess. Piece by piece we will now begin the process of giving America the great HealthCare it deserves!,realDonaldTrump
"Sadly, they and others are Fake News, and the public is just beginning to figure it out! https://t.co/8B8AyA7V1s",realDonaldTrump
RT @billoreilly: A free press is vital to protecting all Americans. A corrupt press damages the Republic.,realDonaldTrump
The Democrats ObamaCare is imploding. Massive subsidy payments to their pet insurance companies has stopped. Dems should call me to fix!,realDonaldTrump
"It is time to take care of OUR COUNTRY, to rebuild OUR COMMUNITIES, and to protect our GREAT AMERICAN WORKERS! #TaxReform https://t.co/FEjGjT4xp9",realDonaldTrump
People are just now starting to find out how dishonest and disgusting (FakeNews) @NBCNews is. Viewers beware. May be worse than even @CNN!,realDonaldTrump
Happy #NationalFarmersDay!_ÙÒühttps://t.co/dN39R1IMlA https://t.co/QbUG1pztaI,realDonaldTrump
"We need a tax system that is FAIR to working FAMILIES &amp; that encourages companies to STAY in AMERICA, GROW in AMERICA, and HIRE in AMERICA! https://t.co/DdI1yWi7YZ",realDonaldTrump
"The time has come to take action to IMPROVE access, INCREASE choices, and LOWER COSTS for HEALTHCARE! _Áühttps://t.co/mz5fdveTVh https://t.co/dDZLsKuNSe",realDonaldTrump
The Fake News Is going all out in order to demean and denigrate! Such hatred!,realDonaldTrump
"...We cannot keep FEMA, the Military &amp; the First Responders, who have been amazing (under the most difficult circumstances) in P.R. forever!",realDonaldTrump
...accountability say the Governor. Electric and all infrastructure was disaster before hurricanes. Congress to decide how much to spend....,realDonaldTrump
"""Puerto Rico survived the Hurricanes, now a financial crisis looms largely of their own making."" says Sharyl Attkisson. A total lack of.....",realDonaldTrump
Clips from tax speech and @seanhannity on @foxandfriends now. Have a great day!,realDonaldTrump
RT @realDonaldTrump: I will be interviewed tonight on @FoxNews by @SeanHannity at 9pmE. Enjoy!,realDonaldTrump
"In even the darkest moments, the light of our people has shown through their goodness, their courage and their love. #USA_Ùà¼_Ùàü https://t.co/8JK8aM2a1L",realDonaldTrump
"Network news has become so partisan, distorted and fake that licenses must be challenged and, if appropriate, revoked. Not fair to public!",realDonaldTrump
Joining @SeanHannity tonight at 9pmE on @FoxNews. Enjoy! https://t.co/RCfiJus5Rw,realDonaldTrump
"We need a tax system that is FAIR to working families &amp; that encourages companies to STAY in America, GROW in America, and HIRE in America_Ùà¼_Ùàü https://t.co/u9ZgijgLE3",realDonaldTrump
I will be interviewed tonight on @FoxNews by @SeanHannity at 9pmE. Enjoy!,realDonaldTrump
"Join me LIVE at 5:45pmE from Harrisburg, Pennsylvania! #TaxReform #USA_Ùà¼_Ùàühttps://t.co/fDUEMpRTcE https://t.co/1mMjl1HNpl",realDonaldTrump
Happy to announce we are awarding $1M to Las Vegas - in order to help local law enforcement working OT to respond to last SundayÛªs tragedy.,realDonaldTrump
"With all of the Fake News coming out of NBC and the Networks, at what point is it appropriate to challenge their License? Bad for country!",realDonaldTrump
"Fake @NBCNews made up a story that I wanted a ""tenfold"" increase in our U.S. nuclear arsenal. Pure fiction, made up to demean. NBC = CNN!",realDonaldTrump
It is about time that Roger Goodell of the NFL is finally demanding that all players STAND for our great National Anthem-RESPECT OUR COUNTRY,realDonaldTrump
"The Democrats want MASSIVE tax increases &amp; soft, crime producing borders.The Republicans want the biggest tax cut in history &amp; the WALL!",realDonaldTrump
It would be really nice if the Fake News Media would report the virtually unprecedented Stock Market growth since the election.Need tax cuts,realDonaldTrump
"...if Congress gives us the massive tax cuts (and reform) I am asking for, those numbers will grow by leaps and bounds. #MAGA",realDonaldTrump
"Stock Market has increased by 5.2 Trillion dollars since the election on November 8th, a 25% increase. Lowest unemployment in 16 years and..",realDonaldTrump
"...fired. This story is totally made up by the dishonest media.The Chief is doing a FANTASTIC job for me and, more importantly, for the USA!",realDonaldTrump
"The Fake News is at it again, this time trying to hurt one of the finest people I know, General John Kelly, by saying he will soon be.....",realDonaldTrump
My great honor to host the 2017 back-to-back #StanleyCup Champion Pittsburgh Penguins at the WH with @FLOTUS today!https://t.co/qyT4bcHVuR https://t.co/rBwGmhMnPX,realDonaldTrump
RT @IsraelUSAforevr: @realDonaldTrump  https://t.co/dBvwKDdesD,realDonaldTrump
"The Failing @nytimes set Liddle' Bob Corker up by recording his conversation. Was made to sound a fool, and that's what I am dealing with!",realDonaldTrump
"Highly respected author, Christopher Bedford, just came out with book, ""The Art of the Donald, Lessons from America's...."" Really good book!",realDonaldTrump
"With Jemele Hill at the mike, it is no wonder ESPN ratings have ""tanked,"" in fact, tanked so badly it is the talk of the industry!",realDonaldTrump
"Since Congress can't get its act together on HealthCare, I will be using the power of the pen to give great HealthCare to many people - FAST",realDonaldTrump
"The problem with agreeing to a policy on immigration is that the Democrats don't want secure borders,they don't care about safety for U.S.A.",realDonaldTrump
"Why is the NFL getting massive tax breaks while at the same time disrespecting our Anthem, Flag and Country? Change tax law!",realDonaldTrump
RT @IvankaTrump: .@realDonaldTrump stock market rally is close to becoming the greatest in 85 years https://t.co/5WlZa82Mij,realDonaldTrump
"A big salute to Jerry Jones, owner of the Dallas Cowboys, who will BENCH players who disrespect our Flag.""Stand for Anthem or sit for game!""",realDonaldTrump
"""President Donald J. Trump Proclaims October 9, 2017, as #ColumbusDay"" https://t.co/cbQRst4lN4",realDonaldTrump
The trip by @VP Pence was long planned. He is receiving great praise for leaving game after the players showed such disrespect for country!,realDonaldTrump
"Our country has been unsuccessfully dealing with North Korea for 25 years, giving billions of dollars &amp; getting nothing. Policy didn't work!",realDonaldTrump
"""The Republican Party is racking up record amounts of small dollar donations - fueled by Trump supporters.....""   @nypost  Thank you!",realDonaldTrump
Nobody could have done what IÛªve done for #PuertoRico with so little appreciation. So much work! https://t.co/k2jAkIpfjI,realDonaldTrump
"Bob Corker gave us the Iran Deal, &amp; that's about it. We need HealthCare, we need Tax Cuts/Reform, we need people that can get the job done!",realDonaldTrump
RT @opinionsamerica: @realDonaldTrump Strong administration leads to a strong response.,realDonaldTrump
FEMA and first responders are working hard (yet again) on Hurricane Nate. Military helping. Very much under control!,realDonaldTrump
"I asked @VP Pence to leave stadium if any players kneeled, disrespecting our country. I am proud of him and @SecondLady Karen.",realDonaldTrump
"...Hence, I would fully expect Corker to be a negative voice and stand in the way of our great agenda. Didn't have the guts to run!",realDonaldTrump
"..my endorsement). He also wanted to be Secretary of State, I said ""NO THANKS."" He is also largely responsible for the horrendous Iran Deal!",realDonaldTrump
"Senator Bob Corker ""begged"" me to endorse him for re-election in Tennessee. I said ""NO"" and he dropped out (said he could not win without...",realDonaldTrump
#LasVegasStrong #USA_Ùà¼_Ùàü_Ù_´https://t.co/4iGwdL4kia,realDonaldTrump
RT @realDonaldTrump: More and more people are suggesting that Republicans (and me) should be given Equal Time on T.V. when you look at theÛ_,realDonaldTrump
Leaving the White House for the Great State of North Carolina. Big progress being made on many fronts!,realDonaldTrump
Thanks for your support! https://t.co/iqUM1RfQso,realDonaldTrump
"...hasn't worked, agreements violated before the ink was dry, makings fools of U.S. negotiators. Sorry, but only one thing will work!",realDonaldTrump
"Presidents and their administrations have been talking to North Korea for 25 years, agreements made and massive amounts of money paid......",realDonaldTrump
Will be joining @GovMikeHuckabee tonight at 8pmE on @TBN. Enjoy! https://t.co/Y5hGPpYZfl,realDonaldTrump
"Our great team at @FEMA is prepared for #HurricaneNate. Everyone in LA, MS, AL, and FL please listen to your local authorities &amp; be safe!",realDonaldTrump
".@NBCNews is so knowingly inaccurate with their reporting. The good news is that the PEOPLE get it, which is really all that matters! Not #1",realDonaldTrump
"I called Chuck Schumer yesterday to see if the Dems want to do a great HealthCare Bill. ObamaCare is badly broken, big premiums. Who knows!",realDonaldTrump
More and more people are suggesting that Republicans (and me) should be given Equal Time on T.V. when you look at the one-sided coverage?,realDonaldTrump
"Late Night host are dealing with the Democrats for their very ""unfunny"" &amp; repetitive material, always anti-Trump! Should we get Equal Time?",realDonaldTrump
"...contributions. The RNC is taking in far more $'s than the Dems, and much of it by my wonderful small donors. I am working hard for them!",realDonaldTrump
"Can't believe I finally got a good story in the @washingtonpost. It discusses the enthusiasm of ""Trump"" voters through campaign....",realDonaldTrump
RT @FoxBusiness: #StockAlert: U.S. markets since the election https://t.co/1kwamJuizO,realDonaldTrump
RT @Scavino45: .@POTUS @realDonaldTrump in the Oval Office w/senior U.S. military leaders prior to dinner hosted by the President &amp; First LÛ_,realDonaldTrump
"Ralph Northam,who is running for Governor of Virginia,is fighting for the violent MS-13 killer gangs &amp; sanctuary cities.  Vote Ed Gillespie!",realDonaldTrump
Rex Tillerson never threatened to resign. This is Fake News put out by @NBCNews. Low news and reporting standards. No verification from me.,realDonaldTrump
Stock Market hits an ALL-TIME high! Unemployment lowest in 16 years! Business and manufacturing enthusiasm at highest level in decades!,realDonaldTrump
Why Isn't the Senate Intel Committee looking into the Fake News Networks in OUR country to see why so much of our news is just made up-FAKE!,realDonaldTrump
Thank you! https://t.co/YMuqSvvTSB,realDonaldTrump
"So wonderful to be in Las Vegas yesterday and meet with people, from police to doctors to the victims themselves, who I will never forget!",realDonaldTrump
"RT @ABC: Pres. Trump: ""We cannot be defined by the evil that threatens us or the violence that incites such terror."" https://t.co/eduBJDysIÛ_",realDonaldTrump
"RT @Scavino45: .@POTUS &amp; @FLOTUS w/ @LVMPD Officer Cook, 2nd day on job, received gunshot wound to the right chest &amp; right arm, saving liveÛ_",realDonaldTrump
RT @Scavino45: .@POTUS @realDonaldTrump and @FLOTUS Melania visit with @UMCSN patient Tiffany Huizarin Las Vegas earlier today. #VegasStronÛ_,realDonaldTrump
RT @FoxNews: Geraldo Blasts 'Fake News' Reports About Trump's Visit to Puerto Rico https://t.co/9jO0D3BMvE,realDonaldTrump
