text,user
"The two fake news polls released yesterday, ABC &amp; NBC, while containing some very positive info, were totally wrong in General E. Watch!",realDonaldTrump
...popular vote. ABC News/Washington Post Poll (wrong big on election) said almost all stand by their vote on me &amp; 53% said strong leader.,realDonaldTrump
New polls out today are very good considering that much of the media is FAKE and almost always negative. Would still beat Hillary in .....,realDonaldTrump
"Eventually, but at a later date so we can get started early, Mexico will be paying, in some form, for the badly needed border wall.",realDonaldTrump
The Democrats don't want money from budget going to border wall despite the fact that it will stop drugs and very bad MS 13 gang members.,realDonaldTrump
ObamaCare is in serious trouble. The Dems need big money to keep it going - otherwise it dies far sooner than anyone would have thought.,realDonaldTrump
"Thank you Lake Worth, Florida. @foxandfriends",realDonaldTrump
Very interesting election currently taking place in France.,realDonaldTrump
I am committed to keeping our air and water clean but always remember that economic growth enhances environmental protection. Jobs matter!,realDonaldTrump
"Today on Earth Day, we celebrate our beautiful forests, lakes and land. We stand committed to preserving the natural beauty of our nation.",realDonaldTrump
Big TAX REFORM AND TAX REDUCTION will be announced next Wednesday.,realDonaldTrump
Next Saturday night I will be holding a BIG rally in Pennsylvania. Look forward to it!,realDonaldTrump
Getting ready to visit Walter Reed Medical Center with Melania. Looking forward to seeing our bravest and greatest Americans!,realDonaldTrump
RT @foxandfriends: Israeli PM Netanyahu praises U.S. policy changes during meeting with Defense. Sec Mattis https://t.co/v2C9oaq3uY,realDonaldTrump
"RT @foxandfriends: Chicago approves new plan to hide illegal immigrants from the feds, plus give them access to city services https://t.co/Û_",realDonaldTrump
"After 5 SB victories since 2002, it was my honor to give Bob Kraft, Coach Belichick, and the players their first tour of the WH Residence. https://t.co/axmdkTmNtF",realDonaldTrump
'Presidential Executive Order on Identifying and Reducing Tax Regulatory Burdens' Executive Order: https://t.co/vk0jEZDHPo https://t.co/6p0vtWh4Xy,realDonaldTrump
"RT @Scavino45: .@POTUS @realDonaldTrump, @IvankaTrump, Jared Kushner, &amp; Dina Powell in the Oval Office today w/ Aya &amp; her brother Basel.#WÛ_",realDonaldTrump
"WELCOME HOME, AYA!#GodBlessTheUSA_Ùà¼_Ùàü https://t.co/CR4I8dvunc",realDonaldTrump
"China is very much the economic lifeline to North Korea so, while nothing is easy, if they want to solve the North Korean problem, they will",realDonaldTrump
"No matter how much I accomplish during the ridiculous standard of the first 100 days, &amp; it has been a lot (including S.C.), media will kill!",realDonaldTrump
Another terrorist attack in Paris. The people of France will not take much more of this. Will have a big effect on presidential election!,realDonaldTrump
RT @foxandfriends: NYT editor apologizes for misleading tweet about New England Patriots' visit to the White House (via @FoxFriendsFirst) hÛ_,realDonaldTrump
A great honor to host PM Paolo Gentiloni of Italy at the White House this afternoon! #ICYMI- Joint Press Conference: https://t.co/o9d31Veybs https://t.co/s6ZwJJiWbQ,realDonaldTrump
"We're going to use American steel, we're going to use American labor, we are going to come first in all deals. _Áühttps://t.co/Ty5011oJjU https://t.co/yC5ZuVavxK",realDonaldTrump
"Failing @nytimes, which has been calling me wrong for two years, just got caught in a big lie concerning New England Patriots visit to W.H.",realDonaldTrump
A great honor to host the @SuperBowl Champion New England @Patriots at the White House today. Congratulations! https://t.co/OX5CPeZ5BZ https://t.co/wXLsO4AZMr,realDonaldTrump
Today I signed the Veterans (OUR HEROES) Choice Program Extension &amp; Improvement Act @ the @WhiteHouse. #S544 Watch_Áühttps://t.co/BVndbqmx8J https://t.co/pdZOuyyE67,realDonaldTrump
#BuyAmericanHireAmerican_Ùà¼_Ùàü https://t.co/JPEXQTVR1E,realDonaldTrump
Dems failed in Kansas and are now failing in Georgia. Great job Karen Handel! It is now Hollywood vs. Georgia on June 20th.,realDonaldTrump
"Despite major outside money, FAKE media support and eleven Republican candidates, BIG ""R"" win with runoff in Georgia. Glad to be of help!",realDonaldTrump
#BuyAmericanHireAmerican_Ùà¼_ÙàüWatch_Áühttps://t.co/AUqYcrgeyn https://t.co/rf9aivVb7g,realDonaldTrump
"Just learned that Jon @Ossoff, who is running for Congress in Georgia, doesn't even live in the district. Republicans, get out and vote!",realDonaldTrump
Republicans must get out today and VOTE in Georgia 6. Force runoff and easy win! Dem Ossoff will raise your taxes-very bad on crime &amp; 2nd A.,realDonaldTrump
"Democrat Jon Ossoff would be a disaster in Congress. VERY weak on crime and illegal immigration, bad for jobs and wants higher taxes. Say NO",realDonaldTrump
I will be interviewed on @foxandfriends by @ainsleyearhardt starting at 6:00 A.M. Enjoy!,realDonaldTrump
The weak illegal immigration policies of the Obama Admin. allowed bad MS 13 gangs to form in cities across U.S. We are removing them fast!,realDonaldTrump
"With eleven Republican candidates running in Georgia (on Tuesday) for Congress, a runoff will be a win. Vote ""R"" for lower taxes &amp; safety!",realDonaldTrump
See you tomorrow Wisconsin!'Trump spurs small-business optimism in Milwaukee area'https://t.co/JUxhO3oqjO,realDonaldTrump
TRUMP APPROVAL HITS 50%https://t.co/vjZkGTyQb9,realDonaldTrump
RT @DRUDGE_REPORT: TRUMP APPROVAL HITS 50% https://t.co/TruX3WzR3U,realDonaldTrump
"The super Liberal Democrat in the Georgia Congressioal race tomorrow wants to protect criminals, allow illegal immigration and raise taxes!",realDonaldTrump
The Fake Media (not Real Media) has gotten even worse since the election. Every story is badly slanted. We have to hold them to the truth!,realDonaldTrump
"A great book for your reading enjoyment: ""REASONS TO VOTE FOR DEMOCRATS"" by Michael J. Knowles.",realDonaldTrump
"""The first 90 days of my presidency has exposed the total failure of the last eight years of foreign policy!"" So true. @foxandfriends",realDonaldTrump
"The recent Kansas election (Congress) was a really big media event, until the Republicans won. Now they play the same game with Georgia-BAD!",realDonaldTrump
"Our military is building and is rapidly becoming stronger than ever before. Frankly, we have no choice!",realDonaldTrump
Someone should look into who paid for the small organized rallies yesterday. The election is over!,realDonaldTrump
I did what was an almost an impossible thing to do for a Republican-easily won the Electoral College! Now Tax Returns are brought up again?,realDonaldTrump
Happy Easter to everyone!,realDonaldTrump
Why would I call China a currency manipulator when they are working with us on the North Korean problem? We will see what happens!,realDonaldTrump
RT @FLOTUS: Looking forward to hosting the annual Easter Egg Roll at the @WhiteHouse on Monday! https://t.co/nz7vucugx9,realDonaldTrump
Weekly Address- https://t.co/tpZ7eqJLUH https://t.co/B2NQzj53ft,realDonaldTrump
RT @DRUDGE_REPORT: GREAT AGAIN: FEDS ARREST MURDER SUSPECT IN 'FAST AND FURIOUS' SCANDAL... https://t.co/clOLxTE3D4,realDonaldTrump
It was a great honor to welcome Atlanta's heroic first responders to the White House this afternoon! https://t.co/ZtC14AJ0xs,realDonaldTrump
Things will work out fine between the U.S.A. and Russia. At the right time everyone will come to their senses &amp; there will be lasting peace!,realDonaldTrump
"I have great confidence that China will properly deal with North Korea. If they are unable to do so, the U.S., with its allies, will! U.S.A.",realDonaldTrump
"Jobs are returning, illegal immigration is plummeting, law, order and justice are being restored. We are truly making America great again!",realDonaldTrump
"One by one we are keeping our promises - on the border, on energy, on jobs, on regulations. Big changes are happening!",realDonaldTrump
Economic confidence is soaring as we unleash the power of private sector job creation and stand up for the American Workers. #AmericaFirst,realDonaldTrump
Great meeting w/ NATO Sec. Gen. We agreed on the importance of getting countries to pay their fair share &amp; focus on the threat of terrorism. https://t.co/e3ACOOOb0y,realDonaldTrump
"Great win in Kansas last night for Ron Estes, easily winning the Congressional race against the Dems, who spent heavily &amp; predicted victory!",realDonaldTrump
Had a very good call last night with the President of China concerning the menace of North Korea.,realDonaldTrump
I will be interviewed by @MariaBartiromo at 6:00 A.M. @FoxBusiness. Enjoy!,realDonaldTrump
Great Strategic &amp; Policy CEO Forum today with my Cabinet Secretaries and top CEO's from around the United States. #AmericaFirst https://t.co/14a2BRy99j,realDonaldTrump
"Ron Estes is running TODAY for Congress in the Great State of Kansas. A wonderful guy, I need his help on Healthcare &amp; Tax Cuts (Reform).",realDonaldTrump
"North Korea is looking for trouble. If China decides to help, that would be great. If not, we will solve the problem without them!  U.S.A.",realDonaldTrump
I explained to the President of China that a trade deal with the U.S. will be far better for them if they solve the North Korean problem!,realDonaldTrump
RT @foxnation: Grateful Syrians React To @realDonaldTrump Strike: 'I'll Name My Son Donald' https://t.co/7KexXsXLUx #SyrianStrikes,realDonaldTrump
"Happy Passover to everyone celebrating in the United States of America, Israel, and around the world. #ChagSameach",realDonaldTrump
Congratulations to Justice Neil Gorsuch on his elevation to the United States Supreme Court. A great day for America! #SCOTUS https://t.co/8KGFSk8BFj,realDonaldTrump
Thank you @USNavy! #USA https://t.co/oD7L8vPgjq,realDonaldTrump
...confidence that President Al Sisi will handle situation properly.,realDonaldTrump
So sad to hear of the terrorist attack in Egypt. U.S. strongly condemns. I have great...,realDonaldTrump
Judge Gorsuch will be sworn in at the Rose Garden of the White House on Monday at 11:00 A.M. He will be a great Justice. Very proud of him!,realDonaldTrump
The reason you don't generally hit runways is that they are easy and inexpensive to quickly fix (fill in and top)!,realDonaldTrump
"Congratulations to our great military men and women for representing the United States, and the world, so well in the Syria attack.",realDonaldTrump
"...goodwill and friendship was formed, but only time will tell on trade.",realDonaldTrump
It was a great honor to have President Xi Jinping and Madame Peng Liyuan of China as our guests in the United States. Tremendous...,realDonaldTrump
RT @IvankaTrump: Very proud of Arabella and Joseph for their performance in honor of President Xi Jinping and Madame Peng Liyuan's officialÛ_,realDonaldTrump
"It was an honor to host our American heroes from the @WWP #SoldierRideDC at the @WhiteHouse today with @FLOTUS, @VP and @SecondLady. #USA_Ùà¼_Ùàü https://t.co/puVTKwUfRp",realDonaldTrump
"JOBS, JOBS, JOBS!https://t.co/XGOQPHywrt https://t.co/B5Qbn6llzE",realDonaldTrump
I am deeply committed to preserving our strong relationship &amp; to strengthening America's long-standing support for Jordan. @KingAbdullahII. https://t.co/ogzxuZ7kla,realDonaldTrump
Great to talk jobs with #NABTU2017. Tremendous spirit &amp; optimism - we will deliver! https://t.co/6lRuQZZHrc,realDonaldTrump
Thank you Sean McGarvey &amp; the entire Governing Board of Presidents for honoring me w/an invite to speak. #NABTU2017 https://t.co/x3IVNT5btk https://t.co/j0CRhiyvDu,realDonaldTrump
.@WhiteHouse #CEOTownHall_Áühttps://t.co/ADSKuUXf1b https://t.co/XHfQ6zmF2H,realDonaldTrump
RT @DRUDGE_REPORT: RICE ORDERED SPY DOCS ON TRUMP? https://t.co/bL2nZRFxk9,realDonaldTrump
It was an honor to welcome President Al Sisi of Egypt to the @WhiteHouse as we renew the historic partnership between the U.S. and Egypt. https://t.co/HE0ryjEFb6,realDonaldTrump
Looking forward to hosting our heroes from the Wounded Warrior Project (@WWP) Soldier Ride to the @WhiteHouse on Thursday! https://t.co/CkN50HPgeo,realDonaldTrump
"Getting ready to meet President al-Sisi of Egypt. On behalf of the United States, I look forward to a long and wonderful relationship.",realDonaldTrump
".@FoxNews from multiple sources: ""There was electronic surveillance of Trump, and people close to Trump. This is unprecedented."" @FBI",realDonaldTrump
Did Hillary Clinton ever apologize for receiving the answers to the debate? Just asking!,realDonaldTrump
Was the brother of John Podesta paid big money to get the sanctions on Russia lifted? Did Hillary know?,realDonaldTrump
"Such amazing reporting on unmasking and the crooked scheme against us by @foxandfriends. ""Spied on before nomination."" The real story.",realDonaldTrump
"Melania and I are honored to light up the @WhiteHouse this evening, for #WorldAutismAwarenessDay. Join us &amp; #LIUB. https://t.co/o07NPQTCyK https://t.co/7zzwSwBdZK",realDonaldTrump
The real story turns out to be SURVEILLANCE and LEAKING! Find the leakers.,realDonaldTrump
"Talks on Repealing and Replacing ObamaCare are, and have been, going on, and will continue until such time as a deal is hopefully struck.",realDonaldTrump
Anybody (especially  Fake News media) who thinks that Repeal &amp; Replace of ObamaCare is dead does not know the love and strength in R Party!,realDonaldTrump
Thank you @JCLayfield -- will get even better as my Administration continues to put #AmericaFirst_Ùà¼_Ùàü https://t.co/AQQzmt10x7,realDonaldTrump
"..not associated with Russia. Trump team spied on before he was nominated."" If this is true, does not get much bigger. Would be sad for U.S.",realDonaldTrump
"Wow, @FoxNews just reporting big news. Source: ""Official behind unmasking is high up. Known Intel official is responsible. Some unmasked....",realDonaldTrump
"...use subsidies to buy health plans."" In other words, Ocare is dead. Good things will happen, however, either with Republicans or Dems.",realDonaldTrump
"The failing @nytimes finally gets it - ""In places where no insurance company offers plans, there will be no way for ObamaCare customers to..",realDonaldTrump
"It is the same Fake News Media that said there is ""no path to victory for Trump"" that is now pushing the phony Russia story. A total scam!",realDonaldTrump
When will Sleepy Eyes Chuck Todd and @NBCNews start talking about the Obama SURVEILLANCE SCANDAL and stop with the Fake Trump/Russia story?,realDonaldTrump
We are going to defend our industry &amp; create a level playing field for the American worker. It is time to put #AmericaFirst &amp; #MAGA! https://t.co/GUWx7JqvCi,realDonaldTrump
'Trump Celebrates American Manufacturing Survey Showing Highest Level of Optimism in 20 Years' _Áühttps://t.co/hSaj7eEHx9 https://t.co/r3rILZyTJP,realDonaldTrump
It is an exciting time for our country!#WeeklyAddress #ConfirmGorsuch https://t.co/tP4bkvTOBq,realDonaldTrump
#ConfirmGorsuch #SCOTUS https://t.co/WkqHYMcYa3,realDonaldTrump
"Great meeting with a wonderful woman today, former Secretary of State, Condoleezza Rice! #USA_Ùà¼_Ùàü https://t.co/ZuriIC3YwG",realDonaldTrump
"It was an honor to welcome the Prime Minister of Denmark, Lars LÌükke Rasmussen {@larsloekke} to the @WhiteHouse yesterday! https://t.co/3OKvdfvuyk",realDonaldTrump
"Mike Flynn should ask for immunity in that this is a witch hunt (excuse for big election loss), by media &amp; Dems, of historic proportion!",realDonaldTrump
Only by enlisting the full potential of women in our society will we be truly able to #MakeAmericaGreatAgain_Ùà¼_Ùàühttps://t.co/n33fsISWax https://t.co/tcXorZfdea,realDonaldTrump
...and job losses. American companies must be prepared to look at other alternatives.,realDonaldTrump
The meeting next week with China will be a very difficult one in that we can no longer have massive trade deficits...,realDonaldTrump
"Where are @RepMarkMeadows, @Jim_Jordan and @Raul_Labrador?#RepealANDReplace #Obamacare",realDonaldTrump
"If @RepMarkMeadows, @Jim_Jordan and @Raul_Labrador would get on board we would have both great healthcare and massive tax cuts &amp; reform.",realDonaldTrump
Great op-ed from @RepKenBuck. Looks like some in the Freedom Caucus are helping me end #Obamacare. https://t.co/Y2vTnIBTBZ,realDonaldTrump
The failing @nytimes has disgraced the media world. Gotten me wrong for two solid years. Change libel laws? https://t.co/QIqLgvYLLi,realDonaldTrump
"The Freedom Caucus will hurt the entire Republican agenda if they don't get on the team, &amp; fast. We must fight them, &amp; Dems, in 2018!",realDonaldTrump
Today we honored our true American heroes on the first-ever National Vietnam War Veterans Day.#ThankAVeteran https://t.co/hnS8jD9Rfr https://t.co/BY44VFuY7K,realDonaldTrump
.@FLOTUS Melania and I were honored to stop by the Women's Empowerment  Panel this afternoon at the @WhiteHouse. https://t.co/xzcpJWICjU https://t.co/rurW4hWcKP,realDonaldTrump
Today's EO established a commission on combating drug addiction and the opioid crisis. Watch listening session_Áühttps://t.co/ny9DG8XSrq https://t.co/NZ3oSk2AJP,realDonaldTrump
If the people of our great country could only see how viciously and inaccurately my administration is covered by certain media!,realDonaldTrump
"Remember when the failing @nytimes apologized to its subscribers, right after the election, because their coverage was so wrong. Now worse!",realDonaldTrump
Why doesn't Fake News talk about Podesta ties to Russia as covered by @FoxNews or money from Russia to Clinton - sale of  Uranium?,realDonaldTrump
A NEW ERA IN AMERICAN ENERGY! #MadeInTheUSA_Ùà¼_ÙàüWatch here: https://t.co/EG02Fdlkba https://t.co/XT12jqoIqj,realDonaldTrump
It was an honor to welcome @GLFOP to the @WhiteHouse today with @VP Pence &amp; Attorney General Sessions. THANK YOU for all you do 24/7/365! https://t.co/UOKsiqMpsx,realDonaldTrump
The failing @NYTimes would do much better if they were honest! https://t.co/ATy8R3knS2,realDonaldTrump
Watch @foxandfriends now on Podesta and Russia!,realDonaldTrump
Big announcement by Ford today. Major investment to be made in three Michigan plants. Car companies coming back to U.S.  JOBS! JOBS! JOBS!,realDonaldTrump
"The Democrats will make a deal with me on healthcare as soon as ObamaCare folds - not long. Do not worry, we are in very  good shape!",realDonaldTrump
The Republican House Freedom Caucus was able to snatch defeat from the jaws of victory. After so many bad years they were ready for a win!,realDonaldTrump
"...money to Bill, the Hillary Russian ""reset,"" praise of Russia by Hillary, or Podesta Russian Company. Trump Russia story is a hoax. #MAGA!",realDonaldTrump
"Why isn't the House Intelligence Committee looking into the Bill &amp; Hillary deal that allowed big Uranium to go to Russia, Russian speech....",realDonaldTrump
General Kelly is doing a great job at the border. Numbers are way down. Many are not even trying to come in anymore.,realDonaldTrump
"Democrats are smiling in D.C. that the Freedom Caucus, with the help of Club For Growth and Heritage, have saved Planned Parenthood &amp; Ocare!",realDonaldTrump
Thanks you for all of the Trump Rallies today. Amazing support. We will all MAKE AMERICA GREAT AGAIN!,realDonaldTrump
Watch @JudgeJeanine on @FoxNews tonight at 9:00 P.M.,realDonaldTrump
ObamaCare will explode and we will all get together and piece together a great healthcare plan for THE PEOPLE. Do not worry!,realDonaldTrump
Happy #MedalOfHonorDay to our heroes! _Áühttps://t.co/juAB1RmMh0 https://t.co/Sw5ea1OwUf,realDonaldTrump
"Today, I was thrilled to announce a commitment of $25 BILLION &amp; 20K AMERICAN JOBS over the next 4 years. THANK YOU Charter Communications! https://t.co/PLxUmXVl0h",realDonaldTrump
"Today, I was pleased to announce the official approval of the presidential permit for the #KeystonePipeline. A great day for American jobs! https://t.co/5ga6XmpStG",realDonaldTrump
"The irony is that the Freedom Caucus, which is very pro-life and against Planned Parenthood, allows P.P. to continue if they stop this plan!",realDonaldTrump
"After seven horrible years of ObamaCare (skyrocketing premiums &amp; deductibles, bad healthcare), this is finally your chance for a great plan!",realDonaldTrump
It was an honor to welcome so many truckers and trucking industry leaders to the @WhiteHouse today! https://t.co/M1veooVBNE,realDonaldTrump
We are taking action to #RepealANDReplace #Obamacare! Contact your Rep &amp; tell them you support #AHCA. #PassTheBill https://t.co/opzrXJigGA https://t.co/C7snoRafPI,realDonaldTrump
"A great American, Kurt Cochran, was killed in the London terror attack. My prayers and condolences are with his family and friends.",realDonaldTrump
Just watched the totally biased and fake news reports of the so-called Russia story on NBC and ABC. Such dishonesty!,realDonaldTrump
Spoke to U.K. Prime Minister Theresa May today to offer condolences on the terrorist attack in London. She is strong and doing very well.,realDonaldTrump
RT @mitchellvii: Trump always ends up being right.  It's almost a little freaky.,realDonaldTrump
RT @mitchellvii: EXACTLY AS I SAID - House Intel Chair: We Cannot Rule Out Sr. Obama Officials Were Involved in Trump Surveillance https://Û_,realDonaldTrump
Big day for healthcare. Working hard!,realDonaldTrump
"Today on #NationalAgDay, we honor our great American farmers &amp; ranchers. Their hard work &amp; dedication are ingrained in our nation's fabric. https://t.co/HG9BGCmSmc",realDonaldTrump
"Honored to sign S.442 today. With this legislation, we support @NASA's scientists, engineers, and astronauts in their pursuit of discovery! https://t.co/9W37qQ0GVf",realDonaldTrump
Joined the @HouseGOP Conference this morning at the U.S. Capitol. https://t.co/03e4YBIWr0 #PassTheBill #MAGA_Ùà¼_Ùàühttps://t.co/USjroMigmr https://t.co/QCeRv9eHaE,realDonaldTrump
"Thank you Louisville, Kentucky. Together, we will MAKE AMERICA SAFE AND GREAT AGAIN! https://t.co/qGgWEWUvek",realDonaldTrump
"Thank you Louisville, Kentucky- on my way! #MAGA_Ùà¼_Ùàü https://t.co/3QsBsib6kt",realDonaldTrump
Congratulations Eric &amp; Lara. Very proud and happy for the two of you! https://t.co/s0T3cTQc40,realDonaldTrump
"What about all of the contact with the Clinton campaign and the Russians? Also, is it true that the DNC would not let the FBI in to look?",realDonaldTrump
Just heard Fake News CNN is doing polls again despite the fact that their election polls were a WAY OFF disaster. Much higher ratings at Fox,realDonaldTrump
"The real story that Congress, the FBI and all others should be looking into is the leaking of Classified information. Must find leaker now!",realDonaldTrump
The Democrats made up and pushed the Russian story as an excuse for running a terrible campaign. Big advantage in Electoral College &amp; lost!,realDonaldTrump
James Clapper and others stated that there is no evidence Potus colluded with Russia. This story is FAKE NEWS and everyone knows it!,realDonaldTrump
#ICYMI: Weekly Address _Áühttps://t.co/ckVx2zgA1x https://t.co/dTGZLvlsGv,realDonaldTrump
"...vast sums of money to NATO &amp; the United States must be paid more for the powerful, and very expensive, defense it provides to Germany!",realDonaldTrump
"Despite what you have heard from the FAKE NEWS, I had a GREAT meeting with German Chancellor Angela Merkel. Nevertheless, Germany owes.....",realDonaldTrump
Great meeting with the @RepublicanStudy Committee this morning at the @WhiteHouse! https://t.co/8Y2UoHoYaY,realDonaldTrump
"""The President Changed. So Has Small Businesses' Confidence""https://t.co/daTGjPmYeJ",realDonaldTrump
"North Korea is behaving very badly. They have been ""playing"" the United States for years. China has done little to help!",realDonaldTrump
"RT @foxandfriends: FOX NEWS ALERT: Jihadis using religious visa to enter US, experts warn (via @FoxFriendsFirst) https://t.co/pwXeR9OMQC",realDonaldTrump
RT @foxandfriends: VIDEO: Rep. Scalise ÛÓ GOP agrees on over 85 percent of health care bill https://t.co/05dtfjAUbx,realDonaldTrump
RT @AmericaFirstPol: MAJOR IMPACT: @POTUS Trump is 50 Days in and moving swiftly to get America back on the right track. #MAGA https://t.cÛ_,realDonaldTrump
RT @FoxNews: Jobs created in February. https://t.co/sOaMDxxTA8,realDonaldTrump
Happy LÌÁ Fheile Phadraig to all of my great Irish friends!,realDonaldTrump
"RT @DiamondandSilk: When the President says ""You're Fired""     That means: ""Pack Yo Stuff and Go, Not Say ""You Refuse to Go!  #DrainTheSwamÛ_",realDonaldTrump
My representatives had a great meeting w/ the Hispanic Chamber of Commerce at the WH today. Look forward to tremendous growth &amp; future mtgs!,realDonaldTrump
Great progress on healthcare. Improvements being made - Republicans coming together!,realDonaldTrump
RT @USHCC: USHCC was delighted to host @IvankaTrump for a roundtable discussion w/ Hispanic women biz owners today in Washington #USHCCLegiÛ_,realDonaldTrump
"An honor to welcome the Taoiseach of Ireland, @EndaKennyTD to the @WhiteHouse today with @VP Pence. _Ùà¼_Ùàü_Ùà¨_Ùà» https://t.co/J3iTl2iSiQ",realDonaldTrump
A budget that puts #AmericaFirst must make safety its no. 1 priorityÛÓwithout safety there can be no prosperity: https://t.co/9lxx1iQo7m,realDonaldTrump
"Thank you Nashville, Tennessee! https://t.co/6snvQ0DzXN",realDonaldTrump
"In Nashville, Tennessee! Lets MAKE AMERICA GREAT AGAIN! https://t.co/m5UR4vv6UH",realDonaldTrump
Thank you Andrew Jackson! #POTUS7 #USA_Ùà¼_Ùàü https://t.co/GToWsWXiNv,realDonaldTrump
