text,user
"How much longer will the failing nytimes, with its big losses and massive unfunded liability (and non-existent sources), remain in business?",realDonaldTrump
The Fake News Media will not talk about the importance of the United Nations Security Council's 15-0 vote in favor of sanctions on N. Korea!,realDonaldTrump
On #PurpleHeartDay_ÙÕÏI thank all the brave men and women who have sacrificed in battle for this GREAT NATION! #USA_Ùà¼_Ùàü https://t.co/QmfdLSLp6p,realDonaldTrump
"...conquests, how brave he was, and it was all a lie. He cried like a baby and begged for forgiveness like a child. Now he judges collusion?",realDonaldTrump
Never in U.S.history has anyone lied or defrauded voters like Senator Richard Blumenthal. He told stories about his Vietnam battles and....,realDonaldTrump
Interesting to watch Senator Richard Blumenthal of Connecticut talking about hoax Russian collusion when he was a  phony Vietnam con artist!,realDonaldTrump
Working hard from New Jersey while White House goes through long planned renovation. Going to New York next week for more meetings.,realDonaldTrump
"Hard to believe that with 24/7 #Fake News on CNN, ABC, NBC, CBS, NYTIMES &amp; WAPO, the Trump base is getting stronger!",realDonaldTrump
"... Supreme Court pick, economic enthusiasm, deregulation &amp; so much more have driven the Trump base even closer together. Will never change!",realDonaldTrump
"...and West Virginia. The fact is the Fake News Russian collusion story, record Stock Market, border security, military strength, jobs.....",realDonaldTrump
"The Trump base is far bigger &amp;  stronger than ever before (despite some phony Fake News polling). Look at rallies in Penn, Iowa, Ohio.......",realDonaldTrump
"The failing @nytimes, which has made every wrong prediction about me including my big election win (apologized), is totally inept!",realDonaldTrump
Just completed call with President Moon of South Korea. Very happy and impressed with 15-0 United Nations vote on North Korea sanctions.,realDonaldTrump
"The Fake News refuses to report the success of the first 6 months: S.C., surging economy &amp; jobs,border &amp; military security,ISIS &amp; MS-13 etc.",realDonaldTrump
RT @IvankaTrump: The Administration is committed to supporting military spouses in the workforce. Thanks Kim for sharing your story! https:Û_,realDonaldTrump
MAKE AMERICA GREAT AGAIN! https://t.co/g4ELhh9joH,realDonaldTrump
United Nations Resolution is the single largest economic sanctions package ever on North Korea. Over one billion dollars in cost to N.K.,realDonaldTrump
Thank you Nicole! https://t.co/KlWN05uFOx,realDonaldTrump
"After many years of LEAKS going on in Washington, it is great to see the A.G. taking action! For National Security, the tougher the better!",realDonaldTrump
The United Nations Security Council just voted 15-0 to sanction North Korea. China and Russia voted with us. Very big financial impact!,realDonaldTrump
"Working in Bedminster, N.J., as long planned construction is being done at the White House. This is not a vacation - meetings and calls!",realDonaldTrump
"RT @RightlyNews: ""What's a high priced Clinton attorney doing representing a low level IT staffer for the Democrats?"" -@jessebwatters on tÛ_",realDonaldTrump
"""Under Trump, gains against #ISIS have dramatically accelerated""https://t.co/jNtOTh0moL",realDonaldTrump
Prosperity is coming back to our shores because we are putting America WORKERS and FAMILIES first. #AmericaFirst_Ùà¼_Ùàü https://t.co/4kTc6Om308,realDonaldTrump
RT @FoxNews: More than 1 million jobs added since @POTUS took office. https://t.co/ZVsC9oi9Ds https://t.co/NNL1FwNMLU,realDonaldTrump
"RT @IvankaTrump: Since @realDonaldTrump inauguration, over 1 million net new jobs have been created in the American economy! #MAGA",realDonaldTrump
"RT @dcexaminer: Emails show Washington Post, New York Times reporters unenthusiastic about covering Clinton-Lynch meeting https://t.co/PKSLÛ_",realDonaldTrump
Great work being done by @FEMA @DHSgov w/state &amp; local leaders to prepare for hurricane season. Preparedness is an investment in our future! https://t.co/e4rbchY3zM,realDonaldTrump
"No matter the mission, the brave men &amp; women of our @USCG proudly answer the call to serve 24/7/365. THANK YOU and HAPPY BIRTHDAY! #CG227_Ùà¼_Ùàü https://t.co/GY555t0vzN",realDonaldTrump
"RT @paultdove: @FoxBusiness Republican Senators who are opposing the President, look at the great economic news: Americans Are Noticing!",realDonaldTrump
RT @Bet22325450ste: @FoxBusiness @foxandfriends Come on America. Get on the Trump Train. The winners already have boarded! The losers are wÛ_,realDonaldTrump
"RT @FoxBusiness: #BreakingNews: U.S. employers added 209,000 jobs in July, unemployment rate down to 4.3% #JobsReport https://t.co/mWaTLMg1Û_",realDonaldTrump
RT @foxandfriends: .@JudgeJeanine: There will be an uproar in this country if they end up with an indictment against a Trump family memberÛ_,realDonaldTrump
RT @RealJamesWoods: I've never witnessed such hatred for a man who is willing to work for free to make his beloved country a better place.Û_,realDonaldTrump
Excellent Jobs Numbers just released - and I have only just begun. Many job stifling regulations continue to fall. Movement back to USA!,realDonaldTrump
"West Virginia was incredible last night. Crowds and enthusiasm were beyond, GDP at 3%, wow!Dem Governor became a Republican last night.",realDonaldTrump
RT @Team_Trump45: @realDonaldTrump We won. Move on. https://t.co/YnUKMoyegB,realDonaldTrump
"Consumer confidence is at a 16 year high....and for good reason. Much more regulation ""busting"" to come. Working hard on tax cuts &amp; reform!",realDonaldTrump
....and don't forget that Foxconn will be spending up to 10 billion dollars on a top of the line plant/plants in Wisconsin.,realDonaldTrump
Toyota &amp; Mazda to build a new $1.6B plant here in the U.S.A. and create 4K new American jobs. A great investment in American manufacturing!,realDonaldTrump
"Thank you West Virginia! All across the country, Americans of every kind are coming together w/one simple goal: to MAKE AMERICA GREAT AGAIN! https://t.co/thRh7htVbH",realDonaldTrump
Just arrived in West Virginia for a MAKE AMERICA GREAT AGAIN rally in Huntington at 7:00pmE. Massive crowd expected - tune in! #MAGA_Ùà¼_Ùàü,realDonaldTrump
"Our GREAT VETERANS can now connect w/ their VA healthcare team from anywhere, using #VAVideoConnect - available at: https://t.co/WFFHLWn8nF. https://t.co/Dmq4htSps9",realDonaldTrump
"Today, I  announced another historic breakthrough for the VA. We are working tirelessly to keep our promises to our GREAT VETERANS! #USA https://t.co/LexSINeM1J",realDonaldTrump
"See you tonight Huntington, West Virginia!#MakeAmericaGreatAgain_Ùà¼_ÙàüTickets: https://t.co/ERU0xUWdCr https://t.co/obtDsdV94t",realDonaldTrump
"Our relationship with Russia is at an all-time &amp; very dangerous  low. You can thank Congress, the same people that can't even give us HCare!",realDonaldTrump
I am continuing to get rid of costly and unnecessary regulations. Much work left to do but effect will be great! Business &amp; jobs will grow.,realDonaldTrump
Business is looking better than ever with business enthusiasm at record levels. Stock Market at an all-time high. That doesn't just happen!,realDonaldTrump
"RT @JacobAWohl: @realDonaldTrump The #MAGA great again movement is WINNING, and the left-wing media can't stand it!",realDonaldTrump
RT @foxandfriends: Insurers seeking huge premium hikes on ObamaCare plans https://t.co/YrUwvMKlyb,realDonaldTrump
"I love the White House, one of the most beautiful buildings (homes) I have ever seen. But Fake News said I called it a dump - TOTALLY UNTRUE",realDonaldTrump
I campaigned on creating a merit-based immigration system that protects U.S. workers &amp; taxpayers. Watch: https://t.co/lv3ScSKnF6 #RAISEAct https://t.co/zCFK5OfYnB,realDonaldTrump
"""Why the Rust Belt just gave Donald Trump a hero's welcome""https://t.co/nqiZ8h8ajk",realDonaldTrump
"It was my great honor to pay tribute to a VET who went above &amp; beyond the call of duty to PROTECT our COMRADES, our COUNTRY, &amp; OUR FREEDOM! https://t.co/YS6y1WR30G",realDonaldTrump
Small business owners are the DREAMERS &amp; INNOVATORS who are powering us into the future!Read more and watch here: https://t.co/hZE3fUqKDf https://t.co/TJn5x6HrFG,realDonaldTrump
Only the Fake News Media and Trump enemies want me to stop using Social Media (110 million people). Only way for me to get the truth out!,realDonaldTrump
"""Corporations have NEVER made as much money as they are making now."" Thank you Stuart Varney @foxandfriends Jobs are starting to roar,watch!",realDonaldTrump
"Stock Market could hit all-time high (again) 22,000 today. Was 18,000 only 6 months ago on Election Day. Mainstream media seldom mentions!",realDonaldTrump
A great day at the White House!,realDonaldTrump
RT @foxandfriends: .@Suffolk_Sheriff praises President Trump for making gang eradication a priority https://t.co/uNY7jBhleE,realDonaldTrump
"Highest Stock Market EVER, best economic numbers in years, unemployment lowest in 17 years, wages raising, border secure, S.C.: No WH chaos!",realDonaldTrump
"If ObamaCare is hurting people, &amp; it is, why shouldn't it hurt the insurance companies &amp; why should Congress not be paying what public pays?",realDonaldTrump
"Don't give up Republican Senators, the World is watching: Repeal &amp; Replace...and go to 51 votes (nuke option), get Cross State Lines &amp; more.",realDonaldTrump
"...they do NOTHING for us with North Korea, just talk. We will no longer allow this to continue. China could easily solve this problem!",realDonaldTrump
"I am very disappointed in China. Our foolish past leaders have allowed them to make hundreds of billions of dollars a year in trade, yet...",realDonaldTrump
"I love reading about all of the ""geniuses"" who were so instrumental in my election success. Problem is, most don't exist. #Fake News! MAGA",realDonaldTrump
"Unless the Republican Senators are total quitters, Repeal &amp; Replace is not dead! Demand another vote before voting on any other bill!",realDonaldTrump
U.S. Stock Market up almost 20% since Election!,realDonaldTrump
"If a new HealthCare Bill is not approved quickly, BAILOUTS for Insurance Companies and BAILOUTS for Members of Congress will end very soon!",realDonaldTrump
"After seven years of ""talking"" Repeal &amp; Replace, the people of our great country are still being forced to live with imploding ObamaCare!",realDonaldTrump
"If the Senate Democrats ever got the chance, they would switch to a 51 majority vote in first minute. They are laughing at R's. MAKE CHANGE!",realDonaldTrump
"....8 Dems totally control the U.S. Senate. Many great Republican bills will never pass, like Kate's Law and complete Healthcare. Get smart!",realDonaldTrump
Republicans in the Senate will NEVER win if they don't go to a 51 vote majority NOW. They look like fools and are just wasting time......,realDonaldTrump
"The very outdated filibuster rule must go. Budget reconciliation is killing R's in Senate. Mitch M, go to 51 Votes NOW and WIN. IT'S TIME!",realDonaldTrump
"Republican Senate must get rid of 60 vote NOW! It is killing the R Party, allows 8 Dems to control country. 200 Bills sit in Senate. A JOKE!",realDonaldTrump
"In other words, Russia was against Trump in the 2016 Election - and why not, I want strong military &amp; low oil prices. Witch Hunt! https://t.co/mMSxj4Su5z",realDonaldTrump
"We will defend our country, protect our communities and put the safety of the AMERICAN PEOPLE FIRST! Replay: https://t.co/dcZxPKOPZ9 https://t.co/0NGiIhGY18",realDonaldTrump
I would like to thank Reince Priebus for his service and dedication to his country. We accomplished a lot together and I am proud of him!,realDonaldTrump
...and a Great Leader. John has also done a spectacular job at Homeland Security. He has been a true star of my Administration,realDonaldTrump
I am pleased to inform you that I have just named General/Secretary John F Kelly as White House Chief of Staff. He is a Great American....,realDonaldTrump
Departing for Long Island now. An area under siege from #MS13 gang members. We will not rest until #MS13 is eradicated. #LESM https://t.co/GsgbBUXyHS,realDonaldTrump
"We will always ENFORCE our laws, PROTECT our borders, and SUPPORT our police! #LESMHarrisburg, Pennsylvania #FlashbackFriday #MS13 https://t.co/79Tskiv69j",realDonaldTrump
"...Even though parts of healthcare could pass at 51, some really good things need 60. So many great future bills &amp; budgets need 60 votes....",realDonaldTrump
"If Republicans are going to pass great future legislation in the Senate, they must immediately go to a 51 vote majority, not senseless 60...",realDonaldTrump
"3 Republicans and 48 Democrats let the American people down. As I said from the beginning, let ObamaCare implode, then deal. Watch!",realDonaldTrump
"Go Republican Senators, Go! Get there after waiting for 7 years. Give America great healthcare!",realDonaldTrump
It was my great HONOR to present our nation's highest award for a public safety officer - THE MEDAL OF VALOR to FIVE AMERICAN HEROES! https://t.co/j7ceXuBZ3f,realDonaldTrump
"Today, we gathered in the East Room to pay tribute to the HEROES whose courageous actions under fire saved so many lives in Alexandria, VA. https://t.co/it52TkLsye",realDonaldTrump
Join me live as we recognize the first responders to the June 14th shooting involving @SteveScalise. #TeamScalise https://t.co/qOolNmB65d https://t.co/6OCn9JfMAG,realDonaldTrump
Big progress being made in ridding our country of MS-13 gang members and gang members in general. MAKE AMERICA SAFE AGAIN!,realDonaldTrump
"...about then candidate Trump."" Catherine Herridge @FoxNews. So why doesn't Fake News report this? Witch Hunt! Purposely phony reporting.",realDonaldTrump
"""One of the things that has been lost in the politics of this situation is that the Russians collected and spread negative information.....",realDonaldTrump
"RT @townhallcom: ABC, NBC, And CBS Pretty Much Bury IT Scandal Engulfing Debbie Wasserman Schultz's Office https://t.co/PjbZ2TGIKb",realDonaldTrump
"Come on Republican Senators, you can do it on Healthcare. After 7 years, this is your chance to shine! Don't let the American people down!",realDonaldTrump
"Wow, the Failing @nytimes said about @foxandfriends ""....the most powerful T.V. show in America.""",realDonaldTrump
"Thank you Foxconn, for investing $10 BILLION DOLLARS with the potential for up to 13K new jobs in Wisconsin! MadeInTheUSA_Ùà¼_Ùàü https://t.co/jJghVeb63s",realDonaldTrump
Congratulations to Boys and Girls Nation. It was my great honor to welcome you to the WH today! Full Remarks: https://t.co/Pb5FTTOyWf https://t.co/U6tfV93dDG,realDonaldTrump
IN AMERICA WE DON'T WORSHIP GOVERNMENT - WE WORSHIP GOD!_Ù_´https://t.co/jIejSgVnnA,realDonaldTrump
"...big dollars ($700,000) for his wife's political run from Hillary Clinton and her representatives. Drain the Swamp!",realDonaldTrump
"Why didn't A.G. Sessions replace Acting FBI Director Andrew McCabe, a Comey friend who was in charge of Clinton investigation but got....",realDonaldTrump
....victory and cannot be burdened with the tremendous medical costs and disruption that transgender in the military would entail. Thank you,realDonaldTrump
....Transgender individuals to  serve in any capacity in the U.S. Military. Our military must be focused on decisive and overwhelming.....,realDonaldTrump
"After consultation with my Generals and military experts, please be advised that the United States Government will not accept or allow......",realDonaldTrump
"Senator @lisamurkowski of the Great State of Alaska really let the Republicans, and our country, down yesterday. Too bad!",realDonaldTrump
The crowd in Ohio was amazing last night - broke all records. We all had a great time in a great State. Will be back soon!,realDonaldTrump
People of Ohio are fantastic. Thank you so much. What an evening! https://t.co/KM0zoaULYH,realDonaldTrump
"It was my great honor to join our wonderful Veterans at AMVETS Post 44 in Youngstown, Ohio this evening. A grateful nation salutes you! https://t.co/RxobYHP1oR",realDonaldTrump
"Just arrived in Youngstown, Ohio with @FLOTUS Melania!#MakeAmericaGreatAgain_Ùà¼_Ùàü_Ù_´https://t.co/A1mrxSksR3 https://t.co/jWX9yBlX8z",realDonaldTrump
.@SenJohnMcCain-Thank you for coming to D.C. for such a vital vote. Congrats to all Rep. We can now deliver grt healthcare to all Americans!,realDonaldTrump
Joint Press Conference with Prime Minister Saad Hariri of Lebanon beginning shortly. Join us live!_Áühttps://t.co/7pquWbEutn https://t.co/JHVHKgrPOY,realDonaldTrump
"""America's Labor Market Continues to Boom"" JOBS, JOBS, JOBS! https://t.co/LuOaR1Iz2e",realDonaldTrump
The American people have waited long enough. There has been enough talk and no action for seven years. Now is the time for action! https://t.co/VdTiYL0Ua7,realDonaldTrump
Will be traveling to the Great State of Ohio tonight. Big crowd expected. See you there!,realDonaldTrump
This will be a very interesting day for HealthCare.The Dems are obstructionists but the Republicans can have a great victory for the people!,realDonaldTrump
Working on major Trade Deal with the United Kingdom. Could be very big &amp; exciting. JOBS! The E.U. is very protectionist with the U.S. STOP!,realDonaldTrump
"Jared Kushner did very well yesterday in proving he did not collude with the Russians. Witch Hunt. Next up, 11 year old Barron Trump!",realDonaldTrump
So great that John McCain is coming back to vote. Brave - American hero! Thank you John.,realDonaldTrump
ObamaCare is torturing the American People.The Democrats have fooled the people long enough. Repeal or Repeal &amp; Replace! I have pen in hand.,realDonaldTrump
"Big day for HealthCare. After 7 years of talking, we will soon see whether or not Republicans are willing to step up to the plate!",realDonaldTrump
"Problem is that the acting head of the FBI &amp; the person in charge of the Hillary investigation, Andrew McCabe, got $700,000 from H for wife!",realDonaldTrump
Attorney General Jeff Sessions has taken a VERY weak position on Hillary Clinton crimes (where are E-mails &amp; DNC server) &amp; Intel leakers!,realDonaldTrump
"Ukrainian efforts to sabotage Trump campaign - ""quietly working to boost Clinton."" So where is the investigation A.G. @seanhannity",realDonaldTrump
Is Fake News Washington Post being used as a lobbyist weapon against Congress to keep Politicians from looking into Amazon no-tax monopoly?,realDonaldTrump
So many stories about me in the @washingtonpost are Fake News. They are as bad as ratings challenged @CNN. Lobbyist for Amazon and taxes?,realDonaldTrump
"The Amazon Washington Post fabricated the facts on my ending massive, dangerous, and wasteful payments to Syrian rebels fighting Assad.....",realDonaldTrump
#2017Jambo- Remember your duty. Honor your history. Take care of the people God puts into your life ÛÒ and LOVE &amp; CHERISH your country! https://t.co/DnNYxGJm4I,realDonaldTrump
Any senator who votes against starting debate is telling America that you are fine w/ the #OCareNightmare! Remarks: https://t.co/tSvWaMdxBA https://t.co/DI7e78hr6N,realDonaldTrump
"Arriving at Joint Base Andrews with @SecretaryPerry, @SecretaryZinke, and @SecPriceMD..... https://t.co/Yxm94XKtuv",realDonaldTrump
Republicans have a last chance to do the right thing on Repeal &amp; Replace after years of talking &amp; campaigning on it.,realDonaldTrump
"Sleazy Adam Schiff, the totally biased Congressman looking into ""Russia,"" spends all of his time on television pushing the Dem loss excuse!",realDonaldTrump
"So why aren't the Committees and investigators, and of course our beleaguered A.G., looking into Crooked Hillarys crimes &amp; Russia relations?",realDonaldTrump
"After 1 year of investigation with Zero evidence being found, Chuck Schumer just stated that ""Democrats should blame ourselves,not Russia.""",realDonaldTrump
"Drain the Swamp should be changed to Drain the Sewer - it's actually much worse than anyone ever thought, and it begins with the Fake News!",realDonaldTrump
"Thank you to @LOUDOBBS for giving the first six months of the Trump Administration an A+. S.C.,reg cutting,Stock M, jobs,border etc. = TRUE!",realDonaldTrump
"If Republicans don't Repeal and Replace the disastrous ObamaCare, the repercussions will be far greater than any of them understand!",realDonaldTrump
"It's hard to read the Failing New York Times or the Amazon Washington Post because every story/opinion, even if should be positive, is bad!",realDonaldTrump
"It's very sad that Republicans, even some that were carried over the line on my back, do very little to protect their President.",realDonaldTrump
"As the phony Russian Witch Hunt continues, two groups are laughing at this excuse for a lost election taking hold, Democrats and Russians!",realDonaldTrump
To every PATRIOT who will serve on the #USSGeraldRFord:÷ÔüKeep the watch_Ùà¼_Ùàü÷ÔüProtect her_Ùà¼_Ùàü÷ÔüDefend her_Ùà¼_Ùàü÷ÔüLOVE HER_Ùà¼_ÙàüGood Luck &amp; Godspeed! https://t.co/shcz5GQkCh,realDonaldTrump
"American steel &amp; American hands have constructed a 100,000 ton message to the world: American MIGHT IS SECOND TO NONE!#USSGeraldRFord #USA https://t.co/Pibf37Eybg",realDonaldTrump
A ship is only as good as the people who serve on it ÛÓ and the AMERICAN SAILOR is the BEST in the world. @USNavy #USSGeraldRFord https://t.co/YmiTLXcCEh,realDonaldTrump
Join me live for the commissioning ceremony of the USS Gerald R. Ford!_Áühttps://t.co/F78iOR64TW #USA https://t.co/PrVceEmPOB,realDonaldTrump
"ObamaCare is dead and the Democrats are obstructionists, no ideas or votes, only obstruction. It is solely up to the 52 Republican Senators!",realDonaldTrump
"The Republican Senators must step up to the plate and, after 7 years, vote to Repeal and Replace. Next, Tax Reform and Infrastructure. WIN!",realDonaldTrump
"In all fairness to Anthony Scaramucci, he wanted to endorse me 1st, before the Republican Primaries started, but didn't think I was running!",realDonaldTrump
"My son Donald openly gave his e-mails to the media &amp; authorities whereas Crooked Hillary Clinton deleted (&amp; acid washed) her 33,000 e-mails!",realDonaldTrump
"...What about all of the Clinton ties to Russia, including Podesta Company, Uranium deal, Russian Reset, big dollar speeches etc.",realDonaldTrump
"So many people are asking why isn't the A.G. or Special Council looking at the many Hillary Clinton or Comey crimes. 33,000 e-mails deleted?",realDonaldTrump
"While all agree the U. S. President has the complete power to pardon, why think of that when only crime so far is LEAKS against us.FAKE NEWS",realDonaldTrump
"This morning I will be going to the Commissioning Ceremony for the largest aircraft carrier in the world, The Gerald R. Ford.  Norfolk, Va.",realDonaldTrump
"The Failing New York Times foiled U.S. attempt to kill the single most wanted terrorist,Al-Baghdadi.Their sick agenda over National Security",realDonaldTrump
"A new INTELLIGENCE LEAK from the Amazon Washington Post,this time against A.G. Jeff Sessions.These illegal leaks, like Comey's, must stop!",realDonaldTrump
Sean Spicer is a wonderful person who took tremendous abuse from the Fake News Media - but his future is bright!,realDonaldTrump
"Today, it was my privilege to welcome survivors of the #USSArizona to the @WhiteHouse. #HonorThem_Ùà¼_ÙàüRemarks: https://t.co/gySxxqazBl https://t.co/6IPmbqVi10",realDonaldTrump
ManufacturersÛª record-high optimism reported in the 1st qtr has carried into the 2nd qtr of 2017 via @ShopFloorNAM:https://t.co/a42fNElct1 https://t.co/WHZtcAxhRQ,realDonaldTrump
"ICYMI- This week we hosted a #MadeInAmerica event, right here at the @WhiteHouse! If it is MADE IN AMERICA, it is the BEST! USA_Ùà¼_Ùàü https://t.co/q4vB9GdE5y",realDonaldTrump
"""Six months in - it is the hope of GROWTH_ÙÒöthat is making America_Ùà¼_ÙàüFOUR TRILLION DOLLARS_ÙÕ¡RICHER."" -Stuart @VarneyCo_Ù_´https://t.co/s7fYOicWGV https://t.co/x9MeUzDom6",realDonaldTrump
#MadeInAmerica_Ùà¼_Ùàü_ÙÒühttps://t.co/39dwlGHI7R https://t.co/VfIrc5Xssx,realDonaldTrump
"Billions of dollars in investments &amp; thousands of new jobs in America! An initiative via Corning, Merck &amp; Pfizer: https://t.co/QneN48bSiq https://t.co/5VtMfuY3PM",realDonaldTrump
"I am asking all citizens to believe in yourselves, believe in your future, and believe, once more, in America. #AmericaFirst_Ùà¼_Ùàü https://t.co/NOnhJyWp4J",realDonaldTrump
"Departing The Pentagon after meetings with @VP Pence, Secretary James Mattis, and our great teams. #MAGA_Ùà¼_Ùàü https://t.co/5d1MSzhjQS",realDonaldTrump
"Melania and I send our thoughts and prayers to Senator McCain, Cindy, and their entire family. Get well soon. https://t.co/fONWVlmYyz",realDonaldTrump
"The Republicans never discuss how good their healthcare bill is, &amp; it will get even better at lunchtime.The Dems scream death as OCare dies!",realDonaldTrump
I will be having lunch at the White House today with Republican Senators concerning healthcare. They MUST keep their promise to America!,realDonaldTrump
RT @FoxNews: U.S. Markets since election. https://t.co/rlWSt30GUd,realDonaldTrump
The Fake News is becoming more and more dishonest! Even a dinner arranged for top 20 leaders in Germany is made to look sinister!,realDonaldTrump
"Fake News story of secret dinner with Putin is ""sick."" All G 20 leaders, and spouses, were invited by the Chancellor of Germany. Press knew!",realDonaldTrump
The Senate must go to a 51 vote majority instead of current 60 votes. Even parts of full Repeal need 60. 8 Dems control Senate. Crazy!,realDonaldTrump
